<?xml version="1.0" encoding="UTF-8"?>
<Medicines xmlns:xsi="http://www.w3.org/2001/XMLSchema-instance"
          xmlns="http://www.example.com/Medicines"
          xsi:schemaLocation="Medicines.xsd">
    <Vitamin name="Retinol" CAS="68-26-8" drug_bank="DB00162" solution="fat">
        <Pharm>Scientists</Pharm>
        <Version analog="Retinol Serum">
            <Producer>Daumann</Producer>
            <Form>liquid</Form>
            <Certificate>
                <Registered_by>Special Committee of Experts of the General Secretariat of Research and Technology</Registered_by>
                <Registration_date>2009-07-12</Registration_date>
                <Expiration_date>2020-09-20</Expiration_date>
            </Certificate>
            <Package>
                <Quantity>60</Quantity>
                <Price>14.95</Price>
            </Package>
            <Dosage>
                <Amount>1 ml</Amount>
                <Frequency>2/day</Frequency>
            </Dosage>
        </Version>
    </Vitamin>
    <Antibiotic name="Amoxicillin" CAS="26787-78-0" drug_bank="DB01060" recipe="false">
        <Pharm>Beecham</Pharm>
        <Version analog="Amoxisar">
            <Producer>Chemical Inc.</Producer>
            <Form>powder</Form>
            <Certificate>
                <Registered_by>UK Health department</Registered_by>
                <Registration_date>2015-11-15</Registration_date>
                <Expiration_date>2020-11-14</Expiration_date>
            </Certificate>
            <Package>
                <Quantity>60</Quantity>
                <Price>3.05</Price>
            </Package>
            <Dosage>
                <Amount>1 vial</Amount>
                <Frequency>3/day</Frequency>
            </Dosage>
        </Version>
        <Version analog="Moxatag">
            <Producer>Vernalis therapeutic</Producer>
            <Form>tablet</Form>
            <Certificate>
                <Registered_by>Specialty Pharmacy Certification Board</Registered_by>
                <Registration_date>2010-03-18</Registration_date>
                <Expiration_date>2021-04-17</Expiration_date>
            </Certificate>
            <Package size="small">
                <Quantity>10</Quantity>
                <Price>172.46</Price>
            </Package>
            <Package size="medium">
                <Quantity>30</Quantity>
                <Price>501.25</Price>
            </Package>
            <Dosage>
                <Amount>1 tablet</Amount>
                <Frequency>1/day</Frequency>
            </Dosage>
        </Version>
    </Antibiotic>
    <Analgetic name="Ibuprofen" CAS="15687-27-1" drug_bank="DB01050" narcotic="false">
        <Pharm>Stewart Adams</Pharm>
        <Version analog="Neurofen">
            <Producer>Reckitt Benckiser</Producer>
            <Form>tablet</Form>
            <Certificate>
                <Registered_by>FDA</Registered_by>
                <Registration_date>2015-09-10</Registration_date>
                <Expiration_date>2028-10-10</Expiration_date>
            </Certificate>
            <Package size="small">
                <Quantity>6</Quantity>
                <Price>7.99</Price>
            </Package>
            <Package size="medium">
                <Quantity>8</Quantity>
                <Price>9.11</Price>
            </Package>
            <Package size="large">
                <Quantity>12</Quantity>
                <Price>11.12</Price>
            </Package>
            <Dosage>
                <Amount>1 tablet</Amount>
                <Frequency>3-4/day</Frequency>
            </Dosage>
        </Version>
    </Analgetic>
</Medicines>